{
  "schemaVersion": 2,
  "catalogVersion": "synthetic-2026-09-12.2",
  "kind": "SYNTHETIC",
  "options": [
    {
      "id": "fictional-complete",
      "displayName": "Fictional Complete",
      "plan": "Synthetic demo plan",
      "region": "Synthetic region",
      "facts": {
        "OIDC": {
          "availability": "OPTIONAL",
          "evidenceStatus": "REVIEWED",
          "sourceUrl": "https://example.invalid/authweave/fictional-complete#oidc",
          "observedAt": "2026-09-12T00:00:00Z"
        },
        "SAML": {
          "availability": "OPTIONAL",
          "evidenceStatus": "REVIEWED",
          "sourceUrl": "https://example.invalid/authweave/fictional-complete#saml",
          "observedAt": "2026-09-12T00:00:00Z"
        },
        "OAUTH2_APIS": {
          "availability": "OPTIONAL",
          "evidenceStatus": "REVIEWED",
          "sourceUrl": "https://example.invalid/authweave/fictional-complete#oauth2_apis",
          "observedAt": "2026-09-12T00:00:00Z"
        },
        "SOCIAL_LOGIN": {
          "availability": "OPTIONAL",
          "evidenceStatus": "REVIEWED",
          "sourceUrl": "https://example.invalid/authweave/fictional-complete#social_login",
          "observedAt": "2026-09-12T00:00:00Z"
        },
        "ENTERPRISE_SSO": {
          "availability": "OPTIONAL",
          "evidenceStatus": "REVIEWED",
          "sourceUrl": "https://example.invalid/authweave/fictional-complete#enterprise_sso",
          "observedAt": "2026-09-12T00:00:00Z"
        },
        "SCIM": {
          "availability": "OPTIONAL",
          "evidenceStatus": "REVIEWED",
          "sourceUrl": "https://example.invalid/authweave/fictional-complete#scim",
          "observedAt": "2026-09-12T00:00:00Z"
        },
        "JIT": {
          "availability": "OPTIONAL",
          "evidenceStatus": "REVIEWED",
          "sourceUrl": "https://example.invalid/authweave/fictional-complete#jit",
          "observedAt": "2026-09-12T00:00:00Z"
        },
        "GROUP_SYNC": {
          "availability": "OPTIONAL",
          "evidenceStatus": "REVIEWED",
          "sourceUrl": "https://example.invalid/authweave/fictional-complete#group_sync",
          "observedAt": "2026-09-12T00:00:00Z"
        },
        "MFA": {
          "availability": "OPTIONAL",
          "evidenceStatus": "REVIEWED",
          "sourceUrl": "https://example.invalid/authweave/fictional-complete#mfa",
          "observedAt": "2026-09-12T00:00:00Z"
        }
      },
      "compatibility": {
        "applications": {
          "B2B_SAAS": {
            "support": "SUPPORTED",
            "evidenceStatus": "REVIEWED",
            "sourceUrl": "https://example.invalid/authweave/fictional-complete#applications-b2b_saas",
            "observedAt": "2026-09-12T00:00:00Z"
          },
          "PARTNER_PORTAL": {
            "support": "SUPPORTED",
            "evidenceStatus": "REVIEWED",
            "sourceUrl": "https://example.invalid/authweave/fictional-complete#applications-partner_portal",
            "observedAt": "2026-09-12T00:00:00Z"
          },
          "PUBLIC_SECTOR_PORTAL": {
            "support": "UNSUPPORTED",
            "evidenceStatus": "REVIEWED",
            "sourceUrl": "https://example.invalid/authweave/fictional-complete#applications-public_sector_portal",
            "observedAt": "2026-09-12T00:00:00Z"
          },
          "INTERNAL_WORKFORCE": {
            "support": "UNSUPPORTED",
            "evidenceStatus": "REVIEWED",
            "sourceUrl": "https://example.invalid/authweave/fictional-complete#applications-internal_workforce",
            "observedAt": "2026-09-12T00:00:00Z"
          }
        },
        "clients": {
          "BROWSER": {
            "support": "SUPPORTED",
            "evidenceStatus": "REVIEWED",
            "sourceUrl": "https://example.invalid/authweave/fictional-complete#clients-browser",
            "observedAt": "2026-09-12T00:00:00Z"
          },
          "NATIVE_MOBILE": {
            "support": "SUPPORTED",
            "evidenceStatus": "REVIEWED",
            "sourceUrl": "https://example.invalid/authweave/fictional-complete#clients-native_mobile",
            "observedAt": "2026-09-12T00:00:00Z"
          },
          "MACHINE_TO_MACHINE": {
            "support": "SUPPORTED",
            "evidenceStatus": "REVIEWED",
            "sourceUrl": "https://example.invalid/authweave/fictional-complete#clients-machine_to_machine",
            "observedAt": "2026-09-12T00:00:00Z"
          }
        },
        "populations": {
          "EXTERNAL_CUSTOMERS": {
            "support": "SUPPORTED",
            "evidenceStatus": "REVIEWED",
            "sourceUrl": "https://example.invalid/authweave/fictional-complete#populations-external_customers",
            "observedAt": "2026-09-12T00:00:00Z"
          },
          "PARTNERS": {
            "support": "SUPPORTED",
            "evidenceStatus": "REVIEWED",
            "sourceUrl": "https://example.invalid/authweave/fictional-complete#populations-partners",
            "observedAt": "2026-09-12T00:00:00Z"
          },
          "CITIZENS": {
            "support": "UNSUPPORTED",
            "evidenceStatus": "REVIEWED",
            "sourceUrl": "https://example.invalid/authweave/fictional-complete#populations-citizens",
            "observedAt": "2026-09-12T00:00:00Z"
          },
          "EMPLOYEES": {
            "support": "UNSUPPORTED",
            "evidenceStatus": "REVIEWED",
            "sourceUrl": "https://example.invalid/authweave/fictional-complete#populations-employees",
            "observedAt": "2026-09-12T00:00:00Z"
          },
          "CONTRACTORS": {
            "support": "UNSUPPORTED",
            "evidenceStatus": "REVIEWED",
            "sourceUrl": "https://example.invalid/authweave/fictional-complete#populations-contractors",
            "observedAt": "2026-09-12T00:00:00Z"
          },
          "INTERNAL_OPERATORS": {
            "support": "SUPPORTED",
            "evidenceStatus": "REVIEWED",
            "sourceUrl": "https://example.invalid/authweave/fictional-complete#populations-internal_operators",
            "observedAt": "2026-09-12T00:00:00Z"
          }
        },
        "tenancy": {
          "MULTI_TENANT_ORGANIZATIONS": {
            "support": "SUPPORTED",
            "evidenceStatus": "REVIEWED",
            "sourceUrl": "https://example.invalid/authweave/fictional-complete#tenancy-multi_tenant_organizations",
            "observedAt": "2026-09-12T00:00:00Z"
          },
          "SINGLE_ORGANIZATION": {
            "support": "SUPPORTED",
            "evidenceStatus": "REVIEWED",
            "sourceUrl": "https://example.invalid/authweave/fictional-complete#tenancy-single_organization",
            "observedAt": "2026-09-12T00:00:00Z"
          },
          "NO_ORGANIZATION_BOUNDARY": {
            "support": "UNSUPPORTED",
            "evidenceStatus": "REVIEWED",
            "sourceUrl": "https://example.invalid/authweave/fictional-complete#tenancy-no_organization_boundary",
            "observedAt": "2026-09-12T00:00:00Z"
          }
        },
        "membership": {
          "SINGLE_ORGANIZATION_PER_USER": {
            "support": "SUPPORTED",
            "evidenceStatus": "REVIEWED",
            "sourceUrl": "https://example.invalid/authweave/fictional-complete#membership-single_organization_per_user",
            "observedAt": "2026-09-12T00:00:00Z"
          },
          "MULTIPLE_ORGANIZATIONS_PER_USER": {
            "support": "SUPPORTED",
            "evidenceStatus": "REVIEWED",
            "sourceUrl": "https://example.invalid/authweave/fictional-complete#membership-multiple_organizations_per_user",
            "observedAt": "2026-09-12T00:00:00Z"
          },
          "NOT_APPLICABLE": {
            "support": "UNSUPPORTED",
            "evidenceStatus": "REVIEWED",
            "sourceUrl": "https://example.invalid/authweave/fictional-complete#membership-not_applicable",
            "observedAt": "2026-09-12T00:00:00Z"
          }
        }
      }
    },
    {
      "id": "fictional-no-scim",
      "displayName": "Fictional No SCIM",
      "plan": "Synthetic demo plan",
      "region": "Synthetic region",
      "facts": {
        "OIDC": {
          "availability": "OPTIONAL",
          "evidenceStatus": "REVIEWED",
          "sourceUrl": "https://example.invalid/authweave/fictional-no-scim#oidc",
          "observedAt": "2026-09-12T00:00:00Z"
        },
        "SAML": {
          "availability": "OPTIONAL",
          "evidenceStatus": "REVIEWED",
          "sourceUrl": "https://example.invalid/authweave/fictional-no-scim#saml",
          "observedAt": "2026-09-12T00:00:00Z"
        },
        "OAUTH2_APIS": {
          "availability": "OPTIONAL",
          "evidenceStatus": "REVIEWED",
          "sourceUrl": "https://example.invalid/authweave/fictional-no-scim#oauth2_apis",
          "observedAt": "2026-09-12T00:00:00Z"
        },
        "SOCIAL_LOGIN": {
          "availability": "OPTIONAL",
          "evidenceStatus": "REVIEWED",
          "sourceUrl": "https://example.invalid/authweave/fictional-no-scim#social_login",
          "observedAt": "2026-09-12T00:00:00Z"
        },
        "ENTERPRISE_SSO": {
          "availability": "OPTIONAL",
          "evidenceStatus": "REVIEWED",
          "sourceUrl": "https://example.invalid/authweave/fictional-no-scim#enterprise_sso",
          "observedAt": "2026-09-12T00:00:00Z"
        },
        "SCIM": {
          "availability": "UNAVAILABLE",
          "evidenceStatus": "REVIEWED",
          "sourceUrl": "https://example.invalid/authweave/fictional-no-scim#scim",
          "observedAt": "2026-09-12T00:00:00Z"
        },
        "JIT": {
          "availability": "OPTIONAL",
          "evidenceStatus": "REVIEWED",
          "sourceUrl": "https://example.invalid/authweave/fictional-no-scim#jit",
          "observedAt": "2026-09-12T00:00:00Z"
        },
        "GROUP_SYNC": {